Research name,Publication Title,Author List,Conf/Journal Details,Year,Full name,Authors and Orcid,Authors without a orcid,ISBN,ISSN,Item Type,Event Type,Refereed,Date of Award,Supervisor(s),Uncontrolled Keywords,Subject,DCU Faculties and Centres,Use License,ID Code,Deposited On,Published in,Publisher,Official URL,Copyright Information,Funders,Additional Information,Tweets,Mendeley Readers
Mark Roantree,A methodology for validating diversity in synthetic time series generation.,"Bahrpeyma, Fouad, Roantree, Mark, Cappellari, Paolo, Scriney, Michael, McCarren, Andrew",MethodsX ,2021,"Fouad Bahrpeyma, Mark Roantree, Paolo Cappellari, Michael Scriney, Andrew McCarren","Bahrpeyma, Fouad, ORCID: 0000-0002-5128-4774, Roantree, Mark, ORCID: 0000-0002-1329-2570, Scriney, Michael, ORCID: 0000-0001-6813-2630, McCarren, Andrew, ORCID: 0000-0002-7297-0984","Cappellari, Paolo",,2215-0161,Article (Published),,Yes,,,"Time series; Forecasting; Time Series Prediction; Diversity, Synthetic time series",Computer Science > Algorithms. Computer Science > Artificial intelligence. Computer Science > Computer simulation. Computer Science > Machine learning. ,DCU Faculties and Schools > Faculty of Engineering and Computing > School of Computing. Research Initiatives and Centres > INSIGHT Centre for Data Analytics. ,,26085,03 Aug 2021 16:01 by  Fouad Bahrpeyma. Last Modified 03 Aug 2021 16:01,,Elsevier,https://dx.doi.org/10.1016/j.mex.2021.101459,© 2021 The Authors. Open Access (CC-BY-4.0),"Science Foundation Ireland under grant number SFI/12/RC/2289, Science Foundation Ireland (SFI) and the Department of Agriculture, Food and Marine on behalf of the Government of Ireland under Grant Number 16/RC/3835.",Article number: 101459,,
Mark Roantree,Voxento: a prototype voice-controlled interactive search engine for lifelogs.,"Alateeq, Ahmed, Roantree, Mark, Gurrin, Cathal","Third Annual Workshop on Lifelog Search Challenge (LSC'20), 27 Oct 2020, Dublin, Ireland",2020,"Ahmed Alateeq, Mark Roantree, Cathal Gurrin","Roantree, Mark, ORCID: 0000-0002-1329-2570, Gurrin, Cathal, ORCID: 0000-0003-4395-7702","Alateeq, Ahmed",978-1-4503-7136-0,,Conference or Workshop Item (Paper),Conference,Yes,,,lifelog; speech recognition; voice interaction; interactive retrieval,UNSPECIFIED,DCU Faculties and Schools > Faculty of Engineering and Computing > School of Computing. Research Initiatives and Centres > INSIGHT Centre for Data Analytics. ,This item is licensed under a Creative Commons Attribution-NonCommercial-Share Alike 3.0 License. View License,24641,17 Jun 2020 15:20 by  Cathal Gurrin. Last Modified 17 Jun 2020 15:20,Proceedings of the Third Annual Workshop on Lifelog Search Challenge (LSC'20)..  Association for Computing Machinery (ACM). ISBN 978-1-4503-7136-0,Association for Computing Machinery (ACM),https://doi.org/10.1145/3379172.3391728,© 2020 The Authors,Science Foundation Ireland and the Insight Centre for Data Analytics through the grant number SFI/12/RC/2289-P2,,,
Mark Roantree,An automated ETL for online datasets.,"McCarthy, Suzanne, McCarren, Andrew, Roantree, Mark","23rd Enterprise Computing Conference (EDOC), 28-31 Oct 2019, Paris, France.",2019,"Suzanne McCarthy, Andrew McCarren, Mark Roantree","McCarren, Andrew, ORCID: 0000-0002-7297-0984","McCarthy, Suzanne, Roantree, Mark",,,Conference or Workshop Item (Paper),Conference,Yes,,,ETL; data warehousing; data transformation; data mining; data models,Computer Science > Machine learning,DCU Faculties and Schools > Faculty of Engineering and Computing > School of Computing. Research Initiatives and Centres > INSIGHT Centre for Data Analytics. ,This item is licensed under a Creative Commons Attribution-NonCommercial-Share Alike 3.0 License. View License,23538,14 May 2020 13:58 by  Suzanne Mc Carthy. Last Modified 14 May 2020 13:58,2019 IEEE 23rd International Enterprise Distributed Object Computing Conference (EDOC)..  IEEE.,IEEE,http://dx.doi.org/10.1109/EDOC.2019.00030,© 2019 The Authors,,,,
Mark Roantree,Benchmarking algorithms for genomic prediction of complex traits.,"Azodi, Christina B., McCarren, Andrew, Roantree, Mark, Gustavo, de los Campos, Shiu, Shin-Han","G3: Genes, Genomes, Genetics, 9 (11). pp. 3691-3702",2019,"Christina B. Azodi, Andrew McCarren, Mark Roantree, de los Campos Gustavo, Shin-Han Shiu","Azodi, Christina B., ORCID: 0000-0002-6097-606X, McCarren, Andrew, ORCID: 0000-0002-7297-0984, Roantree, Mark, ORCID: 0000-0002-1329-2570, Gustavo, de los Campos, ORCID: 0000-0001-5692-7129","Shiu, Shin-Han",,2160-1836,Article (Published),,Yes,,,,Biological Sciences > Biology. Biological Sciences > Genetics. Computer Science > Artificial intelligence. Computer Science > Machine learning. ,DCU Faculties and Schools > Faculty of Engineering and Computing > School of Computing. Research Initiatives and Centres > INSIGHT Centre for Data Analytics. ,,23439,16 Jun 2020 13:57 by  Andrew Mccarren. Last Modified 16 Jun 2020 13:57,,Genetics Society of America,https://doi.org/10.1534/g3.119.400498,© 2019 The Authors.  CC-BY-NC-ND 4.0,"National Science Foundation Graduate Research Fellowship (Fellow ID: 2015196719)(USA), Graduate Research Opportunities Abroad (GROW) Fellowship to C.B.A, U.S. Department of Energy Great Lakes Bioenergy Research Center (BER DE-SC0018409), National Science Foundation (IOS-1546617, DEB-1655386) (USA), National Institute of Health (R01GM099992, R01FM101219) (USA)",,,
Mark Roantree,A method for automated transformation and validation of online datasets.,"McCarthy, Suzanne, McCarren, Andrew, Roantree, Mark","23rd IEEE-EDOC Conference: The Enterprise Computing Conference, 28 -31 Oct 2019, Paris, France.",2019,"Suzanne McCarthy, Andrew McCarren, Mark Roantree","McCarren, Andrew, ORCID: 0000-0002-7297-0984","McCarthy, Suzanne, Roantree, Mark",,,Conference or Workshop Item (Paper),Conference,Yes,,,Data Engineering; ETL; Data Transformation,UNSPECIFIED,DCU Faculties and Schools > Faculty of Engineering and Computing > School of Computing. Research Initiatives and Centres > INSIGHT Centre for Data Analytics. ,This item is licensed under a Creative Commons Attribution-NonCommercial-Share Alike 3.0 License. View License,23636,11 Nov 2019 14:17 by  Suzanne Mc Carthy. Last Modified 13 Dec 2019 13:40,,,,© 2019 The Authors,,,,
Mark Roantree,Representative sample extraction from web data streams.,"Scriney, Michael, Xing, Congcong, McCarren, Andrew, Roantree, Mark","Database and Expert Systems Applications - 30th International Conference, DEXA 2019 {I}, 26-29 Aug 2019, Linz, Austria",2019,"Michael Scriney, Congcong Xing, Andrew McCarren, Mark Roantree","Scriney, Michael, ORCID: 0000-0001-6813-2630, McCarren, Andrew, ORCID: 0000-0002-7297-0984","Xing, Congcong, Roantree, Mark",978-3-030-27614-0,,Conference or Workshop Item (Paper),Conference,Yes,,,Data Warehousing; Data Mining; Data Analytics; ETL; Web Data,UNSPECIFIED,DCU Faculties and Schools > Faculty of Engineering and Computing > School of Computing. Research Initiatives and Centres > INSIGHT Centre for Data Analytics. ,This item is licensed under a Creative Commons Attribution-NonCommercial-Share Alike 3.0 License. View License,23659,23 Aug 2019 09:22 by  Michael Scriney. Last Modified 23 Aug 2019 09:22,"Database and Expert Systems Applications - 30th International Conference, DEXA 2019, Proceedings, Part I. Lecture Notes in Computer Science11706.  Springer. ISBN 978-3-030-27614-0",Springer,https://doi.org/10.1007/978-3-030-27615-7_26,© 2019 Springer,"Science Foundation Ireland (SFI) and the Department of Agriculture, Food and Marine on behalf of the Government of Ireland under Grant Number 16/RC/3835",,,
Mark Roantree,Detecting Multi-Relationship Links in Sparse Datasets.,"Nie, Dongyun, Roantree, Mark","21st International Conference on Enterprise Information Systems (ICEIS 2019, 3-5 May 2019, Heraklion, Greece",2019,"Dongyun Nie, Mark Roantree",,"Nie, Dongyun, Roantree, Mark",978-989-758-372-82,,Conference or Workshop Item (Paper),Conference,Yes,,,Record Linkage; Relationships; Customer Knowledge,UNSPECIFIED,DCU Faculties and Schools > Faculty of Engineering and Computing > School of Computing. Research Initiatives and Centres > INSIGHT Centre for Data Analytics. ,This item is licensed under a Creative Commons Attribution-NonCommercial-Share Alike 3.0 License. View License,22990,16 May 2019 09:45 by  Dongyun Nie. Last Modified 10 Jan 2020 13:44,Proceedings of the 21st International Conference on Enterprise Information Systems (ICEIS 2019..  ICEIS. ISBN 978-989-758-372-82,ICEIS,http://dx.doi.org/10.5220/0007696901490157,© 2019 The Authors,Science Foundation Ireland under grant number SFI/12/RC/2289,,,
Mark Roantree,Combining web and enterprise data for lightweight data mart construction.,"McCarthy, Suzanne, McCarren, Andrew, Roantree, Mark","29th International Conference on Database and Expert Systems Applications (DEXA 2018), 3- 6 Sept 2018, Regensburg, Germany",2018,"Suzanne McCarthy, Andrew McCarren, Mark Roantree","McCarren, Andrew, ORCID: 0000-0002-7297-0984","McCarthy, Suzanne, Roantree, Mark",978-3-319-98811-5,,Conference or Workshop Item (Paper),Conference,Yes,,,,Computer Science > Computer engineering. Computer Science > Computer software. ,Research Initiatives and Centres > INSIGHT Centre for Data Analytics. DCU Faculties and Schools > Faculty of Engineering and Computing > School of Computing. ,This item is licensed under a Creative Commons Attribution-NonCommercial-Share Alike 3.0 License. View License,22388,23 Jul 2018 11:58 by  Mark Roantree. Last Modified 26 Jun 2019 13:48,"Hartmann, Sven and Ma, Hui and Hameurlain, Abdelkader and Pernul, Günther, (eds.)29th International Conference on Database and Expert Systems Applications (DEXA 2018), Proceedings Part 2. Lecture Notes in Computer Science11030.  Springer. ISBN 978-3-319-98811-5",Springer,https://doi.org/10.1007/978-3-319-98812-2_10,© 2018 Springer,Science Foundation Ireland grant number SFI/12/RC/2289,,,
Mark Roantree,Multistep-ahead prediction: a comparison of analytical and algorithmic approaches.,"Bahrpeyma, Fouad, Roantree, Mark, McCarren, Andrew","20th International Conference on Big Data Analytics and Knowledge Discovery - DaWaK 2018, September 3 - 6, 2018, Regensburg, Germany",2018,"Fouad Bahrpeyma, Mark Roantree, Andrew McCarren","Bahrpeyma, Fouad, ORCID: 0000-0002-5128-4774, Roantree, Mark, ORCID: 0000-0002-1329-2570, McCarren, Andrew, ORCID: 0000-0002-7297-0984",,978-3-319-98538-1,,Conference or Workshop Item (Paper),Conference,Yes,,,,Computer Science > Machine learning. Computer Science > Algorithms. ,Research Initiatives and Centres > INSIGHT Centre for Data Analytics. DCU Faculties and Schools > Faculty of Engineering and Computing > School of Computing. ,This item is licensed under a Creative Commons Attribution-NonCommercial-Share Alike 3.0 License. View License,22390,23 Jul 2018 11:53 by  Fouad Bahrpeyma. Last Modified 10 Mar 2021 17:58,Big Data Analytics and Knowledge Discovery. Lecture Notes in Computer Science11031.  Springer. ISBN 978-3-319-98538-1,Springer,https://doi.org/10.1007/978-3-319-98539-8_26,© 2018 Springer,Science Foundation Ireland under grant number SFI/12/RC/2289,,,
Mark Roantree,An architecture and services for constructing data marts from online data sources.,"McCarthy, Suzanne, McCarren, Andrew, Roantree, Mark",Technical Report. UNSPECIFIED.,2018,"Suzanne McCarthy, Andrew McCarren, Mark Roantree","McCarren, Andrew, ORCID: 0000-0002-7297-0984, Roantree, Mark, ORCID: 0000-0002-1329-2570","McCarthy, Suzanne",,,Monograph (Technical Report),,No,,,,Computer Science > Artificial intelligence,Research Initiatives and Centres > INSIGHT Centre for Data Analytics. DCU Faculties and Schools > Faculty of Engineering and Computing > School of Computing. ,This item is licensed under a Creative Commons Attribution-NonCommercial-Share Alike 3.0 License. View License,22386,06 Jun 2018 10:29 by  Mark Roantree. Last Modified 03 Mar 2021 12:21,,,,,Science Foundation Ireland  grant number SFI/12/RC/2289,,,
Mark Roantree,Multi-resolution forecast aggregation for time series in agri datasets.,"Bahrpeyma, Fouad, Roantree, Mark, McCarren, Andrew","Irish Conference on Artificial Intelligence and Cognitive Science (AICS 2017), 7-8 Dec 2017, Dublin, Ireland",2017,"Fouad Bahrpeyma, Mark Roantree, Andrew McCarren","Bahrpeyma, Fouad, ORCID: 0000-0002-5128-4774, McCarren, Andrew, ORCID: 0000-0002-7297-0984","Roantree, Mark",1613-0073,1613-0073,Conference or Workshop Item (Paper),Conference,Yes,,,Time series prediction; Multistep ahead prediction; Forecasting; The small sample size problem; Recurrent Neural Networks; Forecast Aggregation; Multi-resolution Analysis; Prediction in the long run; Resolution of Impact (ROI); Univariate time series; Time series analysis;,Computer Science > Computational complexity. Computer Science > Machine learning. Computer Science > Artificial intelligence. Computer Science > Algorithms. ,Research Initiatives and Centres > INSIGHT Centre for Data Analytics. DCU Faculties and Schools > Faculty of Engineering and Computing > School of Computing. ,This item is licensed under a Creative Commons Attribution-NonCommercial-Share Alike 3.0 License. View License,22079,10 Jan 2018 16:41 by  Thomas Murtagh. Last Modified 26 Jun 2019 10:41,"McAuley, John and McKeever, Susan, (eds.)Proceedings of the 25th Irish Conference on Artificial Intelligence and Cognitive Science.2087.  CEUR-WS. ISBN ISSN 1613-0073",CEUR-WS,http://ceur-ws.org/Vol-2086/AICS2017_paper_24.pdf,© 2017 The Authors,Science Foundation Ireland grant number SFI/12/RC/2289,,,
Mark Roantree,Physiological profile and activity pattern of minor Gaelic football players.,"Cullen, Bryan, Roantree, Mark, McCarren, Andrew, Kelly, David T., O'Connor, Paul L., Huges, Sarah, Daly, Pat G., Moyna, Niall","Journal of Strength and Conditioning Research, 31 (7). pp. 1811-1820",2017,"Bryan Cullen, Mark Roantree, Andrew McCarren, David T. Kelly, Paul L. O'Connor, Sarah Huges, Pat G. Daly, Niall Moyna","McCarren, Andrew, ORCID: 0000-0002-7297-0984, Moyna, Niall, ORCID: 0000-0003-1061-8528","Cullen, Bryan, Roantree, Mark, Kelly, David T., O'Connor, Paul L., Huges, Sarah, Daly, Pat G.",,1064-8011,Article (Published),,Yes,,,GPS technology; team sports; heart rate; Gaelic games,Medical Sciences > Physiology,DCU Faculties and Schools > Faculty of Science and Health > School of Health and Human Performance. Research Initiatives and Centres > CLARITY: The Centre for Sensor Web Technologies. DCU Faculties and Schools > Faculty of Engineering and Computing > School of Computing. ,This item is licensed under a Creative Commons Attribution-NonCommercial-Share Alike 3.0 License. View License,22405,29 Jun 2018 13:20 by  Andrew Mccarren. Last Modified 26 Jun 2019 10:37,,"Lippincott, Williams & Wilkins",https://doi.org/10.1519/JSC.0000000000001667,© 2016 National Strength and Conditioning Association,"Cumann Lutchleas Gael, Science Foundation Ireland",,,
Mark Roantree,Integrating online data for smart city data marts.,"Roantree, Mark, Scriney, Michael, O'Connor, Martin F.","31st British International Conference on Databases, 10-12 July 2017, London, UK",2017,"Mark Roantree, Michael Scriney, Martin F. O'Connor","Scriney, Michael, ORCID: 0000-0001-6813-2630","Roantree, Mark, O'Connor, Martin F.",978-3-319-60794-8,,Conference or Workshop Item (Paper),Conference,Yes,,,,Computer Science > Computer software. Computer Science > Computer engineering. ,Research Initiatives and Centres > INSIGHT Centre for Data Analytics,This item is licensed under a Creative Commons Attribution-NonCommercial-Share Alike 3.0 License. View License,21765,20 Jul 2017 10:01 by  Michael John Scriney. Last Modified 23 Aug 2019 08:57,"31st British International Conference on Databases, BICOD 2017, London, UK, July 10–12, 2017, Proceedings. Data Analytics10365(1).  Springer International Publishing. ISBN 978-3-319-60794-8",Springer International Publishing,http://dx.doi.org/10.1007/978-3-319-60795-5,© 2017 Springer International Publishing,"Science Foundation Ireland, SFI/12/RC/2289",,,
Mark Roantree,"Predicting prices, volume and trade for meat and dairy products: an agri food data model.","McCarthy, Suzanne, McCarren, Andrew, Roantree, Mark",Technical Report. UNSPECIFIED.,2017,"Suzanne McCarthy, Andrew McCarren, Mark Roantree","McCarren, Andrew, ORCID: 0000-0002-7297-0984","McCarthy, Suzanne, Roantree, Mark",,,Monograph (Technical Report),,No,,,,UNSPECIFIED,Research Initiatives and Centres > INSIGHT Centre for Data Analytics. DCU Faculties and Schools > Faculty of Engineering and Computing > School of Computing. ,This item is licensed under a Creative Commons Attribution-NonCommercial-Share Alike 3.0 License. View License,23079,14 Mar 2019 15:02 by  Suzanne Mc Carthy. Last Modified 14 Mar 2019 15:02,,,,© 2017 The Authors,Science Foundation Ireland under grant number SFI/12/RC/2289,,,
Mark Roantree,Anomaly detection in agri warehouse construction.,"McCarren, Andrew, McCarthy, Suzanne, O'Sullivan, Conor, Roantree, Mark","Australasian Computer Science Week (ACSW ’17), 31 Jan- 3 Feb, 2017, Geelong, Australia",2017,"Andrew McCarren, Suzanne McCarthy, Conor O'Sullivan, Mark Roantree","McCarren, Andrew, ORCID: 0000-0002-7297-0984","McCarthy, Suzanne, O'Sullivan, Conor, Roantree, Mark",978-1-4503-4768-6,,Conference or Workshop Item (Paper),Conference,Yes,,,Data Warehouse; Agri; Data Mining; Anomaly Detection,Computer Science > Algorithms,Research Initiatives and Centres > INSIGHT Centre for Data Analytics. DCU Faculties and Schools > Faculty of Engineering and Computing > School of Computing. ,This item is licensed under a Creative Commons Attribution-NonCommercial-Share Alike 3.0 License. View License,22396,25 Jun 2018 13:14 by  Suzanne Mc Carthy. Last Modified 06 Nov 2019 16:22,Proceedings of the Australasian Computer Science Week Multiconference 2017. Australasian Computer Science Week Multiconference(17).  ACM. ISBN 978-1-4503-4768-6,ACM,http://dx.doi.org/10.1145/3014812.3014829,© 2017 ACM,Enterprise Ireland Grant Ref. CF-2014-4611,,,
Mark Roantree,Generating cubes from smart city web data.,"Scriney, Michael, O'Connor, Martin F., Roantree, Mark","Australasian Computer Science Week (ACSW 2016), 31 Jan - 3 Feb, 2017, Geelong, Australia",2017,"Michael Scriney, Martin F. O'Connor, Mark Roantree","Scriney, Michael, ORCID: 0000-0001-6813-2630","O'Connor, Martin F., Roantree, Mark",978-1-4503-4768-6,,Conference or Workshop Item (Paper),Conference,Yes,,,Data Warehousing; Data Cubes; OLAP; Smart City,Computer Science > Computer software. Computer Science > Computer engineering. ,Research Initiatives and Centres > INSIGHT Centre for Data Analytics. DCU Faculties and Schools > Faculty of Engineering and Computing > School of Computing. ,This item is licensed under a Creative Commons Attribution-NonCommercial-Share Alike 3.0 License. View License,21466,03 Feb 2017 14:35 by  Michael John Scriney. Last Modified 23 Aug 2019 08:55,"Proceedings of the Australasian Computer Science Week Multiconference..  ACM New York, NY, USA. ISBN 978-1-4503-4768-6","ACM New York, NY, USA",https://doi.org/10.1145/3014812.3014863,© 2017 ACM.,"Science Foundation Ireland, SFI/12/RC/2289",,,
Mark Roantree,Detecting feature interactions in agricultural trade data using a deep neural network.,"O'Donoghue, Jim, Roantree, Mark, McCarren, Andrew","Big Data Analytics and Knowledge Discovery - DaWaK 2017, 28 - 31 Aug, 2017, Lyon, France",2017,"Jim O'Donoghue, Mark Roantree, Andrew McCarren","McCarren, Andrew, ORCID: 0000-0002-7297-0984","O'Donoghue, Jim, Roantree, Mark",978-3-319-64282-6,,Conference or Workshop Item (Paper),Conference,Yes,,,Deep learning; data mining; Agri-analytics; deep architecture; big data;,Computer Science > Machine learning,Research Initiatives and Centres > INSIGHT Centre for Data Analytics. DCU Faculties and Schools > Faculty of Engineering and Computing > School of Computing. ,This item is licensed under a Creative Commons Attribution-NonCommercial-Share Alike 3.0 License. View License,21859,25 Aug 2017 10:34 by  Mark Roantree. Last Modified 26 Jun 2019 10:35,"Bellatreche, Ladjel and Chakravarthy, Sharma, (eds.)International Conference on Big Data Analytics and Knowledge Discovery. Lecture Notes in Computer Science book series (LNCS)10440.  Springer. ISBN 978-3-319-64282-6",Springer,https://doi.org/10.1007/978-3-319-64283-3_33,© 2017 Springer International Publishing,Science Foundation Ireland  grant no. SFI/12/RC/2289,,,
Mark Roantree,A toolkit for analysis of deep learning experiments.,"O'Donoghue, Jim, Roantree, Mark","The 15th International Symposium on Intelligent Data Analysis, 13-15 Oct 2016, Stockholm, Sweden.",2016,"Jim O'Donoghue, Mark Roantree",,"O'Donoghue, Jim, Roantree, Mark",,,Conference or Workshop Item (Paper),Conference,Yes,,,,Computer Science > Machine learning. Medical Sciences > Exercise. Computer Science > Computer software. Computer Science > Artificial intelligence. Computer Science > Algorithms. Medical Sciences > Sports sciences. ,Research Initiatives and Centres > INSIGHT Centre for Data Analytics. DCU Faculties and Schools > Faculty of Engineering and Computing > School of Computing. ,,21258,13 Oct 2016 09:48 by  Jim O'Donoghue. Last Modified 19 Jul 2018 15:08,,IEEE,,,,,,
Mark Roantree,Variable interactions in risk factors for dementia.,"O'Donoghue, Jim, Roantree, Mark, McCarren, Andrew","IEEE Tenth International Conference on Research Challenges in Information Science, 1 -3 Jun 2016, Grenoble. France.",2016,"Jim O'Donoghue, Mark Roantree, Andrew McCarren","McCarren, Andrew, ORCID: 0000-0002-7297-0984","O'Donoghue, Jim, Roantree, Mark",,,Conference or Workshop Item (Paper),Conference,Yes,,,Neural networks; Dementia; Risk factor interactions; Survival analysis,Computer Science > Machine learning. Computer Science > Artificial intelligence. Medical Sciences > Health. ,Research Initiatives and Centres > INSIGHT Centre for Data Analytics. DCU Faculties and Schools > Faculty of Engineering and Computing > School of Computing. ,This item is licensed under a Creative Commons Attribution-NonCommercial-Share Alike 3.0 License. View License,21189,01 Jul 2016 08:19 by  Jim O'Donoghue. Last Modified 26 Jun 2019 10:34,10th {IEEE} International Conference on Research Challenges in Information Science..  IEEE.,IEEE,,,"Science Foundation Ireland, European Framework Programme 7",,,
Mark Roantree,Efficient cube construction for smart city data.,"Scriney, Michael, Roantree, Mark","EDBT/ICDT 2016 Joint Conference, 15-18 Mar 2016, Bordeaux, France.",2016,"Michael Scriney, Mark Roantree","Scriney, Michael, ORCID: 0000-0001-6813-2630","Roantree, Mark",,,Conference or Workshop Item (Paper),Workshop,Yes,,,Smart City; Data Streams; Cubes; XML Analytics,Computer Science > Software engineering,Research Initiatives and Centres > INSIGHT Centre for Data Analytics. DCU Faculties and Schools > Faculty of Engineering and Computing > School of Computing. ,This item is licensed under a Creative Commons Attribution-NonCommercial-Share Alike 3.0 License. View License,21119,31 Mar 2016 10:16 by  Michael John Scriney. Last Modified 23 Aug 2019 08:52,"Proceedings of the Workshops of the EDBT/ICDT 2016 Joint Conference, EDBT/ICDT Workshops 2016, Bordeaux, France, March 15, 2016. CEUR Workshop Proceedings1558.  CEUR-WS.org.",CEUR-WS.org,http://ceur-ws.org/Vol-1558/paper6.pdf,,Science Foundation Ireland under grant number SFI/12/RC/2289,,,
Mark Roantree,Exploring variable interactions with restricted Boltzmann machines.,"O'Donoghue, Jim, Roantree, Mark","Insight Student Conference 2015, 30 Oct 2015, NUIG, Galway, Ireland.",2015,"Jim O'Donoghue, Mark Roantree",,"O'Donoghue, Jim, Roantree, Mark",,,Conference or Workshop Item (Poster),Conference,Yes,,,In-MINDD,Computer Science > Machine learning. Computer Science > Artificial intelligence. ,DCU Faculties and Schools > Faculty of Engineering and Computing > School of Computing,This item is licensed under a Creative Commons Attribution-NonCommercial-Share Alike 3.0 License. View License,21266,26 Jul 2016 09:51 by  Jim O'Donoghue. Last Modified 19 Jul 2018 15:08,,,,,"European Framework Programme 7, Science Foundation Ireland",,,
Mark Roantree,Anomaly and event detection for unsupervised athlete performance data.,"O'Donoghue, Jim, Roantree, Mark, Cullen, Bryan, Moyna, Niall, O'Sullivan, Conor, McCarren, Andrew","LWA 2015: Knowledge Discovery and Machine Learning stream, 7-9 Oct 2015, Trier, Germany.",2015,"Jim O'Donoghue, Mark Roantree, Bryan Cullen, Niall Moyna, Conor O'Sullivan, Andrew McCarren","Moyna, Niall, ORCID: 0000-0003-1061-8528, McCarren, Andrew, ORCID: 0000-0002-7297-0984","O'Donoghue, Jim, Roantree, Mark, Cullen, Bryan, O'Sullivan, Conor",,,Conference or Workshop Item (Paper),Conference,Yes,,,,Computer Science > Machine learning,Research Initiatives and Centres > INSIGHT Centre for Data Analytics. DCU Faculties and Schools > Faculty of Engineering and Computing > School of Computing. ,This item is licensed under a Creative Commons Attribution-NonCommercial-Share Alike 3.0 License. View License,20867,23 Oct 2015 10:26 by  Jim O'Donoghue. Last Modified 26 Jun 2019 10:33,"Proceedings of the {LWA} 2015 Workshops: KDML, FGWM, IR, and FGDB, Trier, Germany, October 7-9, 2015. {CEUR} Workshop Proceedings1458.  CEUR-WS.org.",CEUR-WS.org,http://ceur-ws.org/Vol-1458/E27_CRC63_Odonoghue.pdf,,European Framework Programme 7,,,
