Research name,Publication Title,Author List,Conf/Journal Details,Year,Full name,Authors and Orcid,Authors without a orcid,ISBN,ISSN,Item Type,Event Type,Refereed,Date of Award,Supervisor(s),Uncontrolled Keywords,Subject,DCU Faculties and Centres,Use License,ID Code,Deposited On,Published in,Publisher,Official URL,Copyright Information,Funders,Additional Information,Tweets,Mendeley Readers
Murat YILMAZ,An auction-based serious game for bug tracking.,"Üsfekes, Çağdaş, Tüzün, Eray, Yilmaz, Murat, Macit, Yagup, Clarke, Paul","IET Software, 13 (5). pp. 386-392",2019,"Çağdaş Üsfekes, Eray Tüzün, Murat Yilmaz, Yagup Macit, Paul Clarke","Tüzün, Eray, ORCID: 0000-0002-5550-7816, Yilmaz, Murat, ORCID: 0000-0002-2446-3224, Clarke, Paul, ORCID: 0000-0002-4487-627X","Üsfekes, Çağdaş, Macit, Yagup",,1751-8814,Article (Published),,Yes,,,Monte Carlo methods; program debugging; software development management; computer games; software maintenance; public domain software; project management,Computer Science > Software engineering,DCU Faculties and Schools > Faculty of Engineering and Computing > School of Computing. Research Initiatives and Centres > Lero: The Irish Software Engineering Research Centre. ,This item is licensed under a Creative Commons Attribution-NonCommercial-Share Alike 3.0 License. View License,24034,19 Dec 2019 09:26 by  Thomas Murtagh. Last Modified 05 Feb 2020 11:35,,Institution of Engineering and Technology (IET),http://dx.doi.org/10.1049/iet-sen.2018.5144,© 2019 IET,Science Foundation Ireland grant 13/RC/2094,,,
Murat YILMAZ,"Applying blockchain to improve the integrity of
the software development process.","Yilmaz, Murat, Tasel, Serdar, Tüzün, Eray, Güleç, Ulaş, O'Connor, Rory, Clarke, Paul","26th European and Asian Conference on Systems, Software and Services Process Improvement (EuroSPI 2019), 18-20 Sept 2019, Edinburgh, Scotland",2019,"Murat Yilmaz, Serdar Tasel, Eray Tüzün, Ulaş Güleç, Rory O'Connor, Paul Clarke","Yilmaz, Murat, ORCID: 0000-0002-2446-3224, Tasel, Serdar, ORCID: 0000-0002-6671-8993, Tüzün, Eray, ORCID: 0000-0002-5550-7816, Güleç, Ulaş, ORCID: 0000-0002-6084-3590, O'Connor, Rory, ORCID: 0000-0001-9253-0313, Clarke, Paul, ORCID: 0000-0002-4487-627X",,978-3-030-28004-8,,Conference or Workshop Item (Paper),Conference,Yes,,,Software Production; Blockchain; Software Development Integrity; Test-driven Software Development.,Computer Science > Software engineering,DCU Faculties and Schools > Faculty of Engineering and Computing > School of Computing. Research Initiatives and Centres > Lero: The Irish Software Engineering Research Centre. ,This item is licensed under a Creative Commons Attribution-NonCommercial-Share Alike 3.0 License. View License,23885,23 Oct 2019 09:54 by  Thomas Murtagh. Last Modified 30 Sep 2021 09:44,"Walker, Alastair and O'Connor, Rory and Messnarz, Richard, (eds.)Proceedings of the 26th European and Asian Conference on Systems, Software and Services Process Improvement (EuroSPI 2019). Communications in Computer and Information Science1060.  Springer. ISBN 978-3-030-28004-8",Springer,http://dx.doi.org/10.1007/978-3-030-28005-5_20,© 2019 Springer,,,,
Murat YILMAZ,"Assessing personality traits in a large scale software development
company: exploratory industrial case study.","Akarsu, Zulal, Orgun, Pinar, Dinc, Hakan, Gunyel, Bora, Yilmaz, Murat","26th European Conference on Software Process Improvement (2019), 18 - 20 Sept 2019, Edinburgh, Scotland",2019,"Zulal Akarsu, Pinar Orgun, Hakan Dinc, Bora Gunyel, Murat Yilmaz","Yilmaz, Murat, ORCID: 0000-0002-2446-3224","Akarsu, Zulal, Orgun, Pinar, Dinc, Hakan, Gunyel, Bora",978-3-030-28004-8,,Conference or Workshop Item (Paper),Conference,Yes,,,"Software Team Visualization; Agile Software Development;
Personality Assessment; Industrial Case Study",UNSPECIFIED,DCU Faculties and Schools > Faculty of Engineering and Computing > School of Computing,This item is licensed under a Creative Commons Attribution-NonCommercial-Share Alike 3.0 License. View License,24033,18 Dec 2019 15:09 by  Thomas Murtagh. Last Modified 18 Dec 2019 15:09,European Conference on Software Process Improvement. Communications in Computer and Information Science (CCIS)1060.  Springer. ISBN 978-3-030-28004-8,Springer,http://dx.doi.org/10.1007/978-3-030-28005-5_15,© 2019 Springer,,,,
Murat YILMAZ,CENGO: a web-based serious game to increase the programming knowledge levels of computer engineering students.,"Güleç, Ulaş, Yilmaz, Murat, Yalcin, Alihan Dogus, O'Connor, Rory, Clarke, Paul","26th European and Asian Conference on Systems, Software and Services Process Improvement (EuroSPI 2019), 18-20 Sept 2019, Edinburgh, Scotland",2019,"Ulaş Güleç, Murat Yilmaz, Alihan Dogus Yalcin, Rory O'Connor, Paul Clarke","Güleç, Ulaş, ORCID: 0000-0002-6084-3590, Yilmaz, Murat, ORCID: 0000-0002-2446-3224, O'Connor, Rory, ORCID: 0000-0001-9253-0313, Clarke, Paul, ORCID: 0000-0002-4487-627X","Yalcin, Alihan Dogus",978-3-030-28004-8,,Conference or Workshop Item (Paper),Conference,Yes,,,Serious games; continuous education; personal improvement,Computer Science > Computer engineering,DCU Faculties and Schools > Faculty of Engineering and Computing > School of Computing. Research Initiatives and Centres > Lero: The Irish Software Engineering Research Centre. ,This item is licensed under a Creative Commons Attribution-NonCommercial-Share Alike 3.0 License. View License,23884,22 Oct 2019 13:55 by  Thomas Murtagh. Last Modified 04 Feb 2020 13:21,"Walker, Alastair and O'Connor, Rory and Messnarz, Richard, (eds.)Proceedings of the 26th European and Asian Conference on Systems, Software and Services Process Improvement (EuroSPI 2019). Communications in Computer and Information Science1060.  Springer. ISBN 978-3-030-28004-8",Springer,http://dx.doi.org/10.1007/978-3-030-28005-5_18,© 2019 Springer,,,,
Murat YILMAZ,Software testing: a changing career.,"Cunningham, Sean, Gambo, Jemil, Lawless, Aidan, Moore, Declan, Yilmaz, Murat, Clarke, Paul, O'Connor, Rory","26th European and Asian Conference on Systems, Software and Services Process Improvement (EuroSPI 2019), 18-20 Sept 2019, Edinburgh, Scotland",2019,"Sean Cunningham, Jemil Gambo, Aidan Lawless, Declan Moore, Murat Yilmaz, Paul Clarke, Rory O'Connor","Yilmaz, Murat, ORCID: 0000-0002-2446-3224, Clarke, Paul, ORCID: 0000-0002-4487-627X, O'Connor, Rory, ORCID: 0000-0001-9253-0313","Cunningham, Sean, Gambo, Jemil, Lawless, Aidan, Moore, Declan",978-3-030-28004-8,,Conference or Workshop Item (Paper),Conference,Yes,,,"software quality improvement; test drive development; continuous
development; software development lifecycle",Computer Science > Software engineering,DCU Faculties and Schools > Faculty of Engineering and Computing > School of Computing. Research Initiatives and Centres > Lero: The Irish Software Engineering Research Centre. ,This item is licensed under a Creative Commons Attribution-NonCommercial-Share Alike 3.0 License. View License,23873,22 Oct 2019 13:52 by  Thomas Murtagh. Last Modified 26 Nov 2019 14:26,"Walker, Alastair and O'Connor, Rory and Messnarz, Richard, (eds.)Proceedings of the 26th European and Asian Conference on Systems, Software and Services Process Improvement (EuroSPI 2019). Communications in Computer and Information Science1060.  Springer. ISBN 978-3-030-28004-8",Springer,http://dx.doi.org/10.1007/978-3-030-28005-5_57,© 2019 Springer,Science Foundation Ireland grant 13/RC/2094 to Lero - the Irish Software Research Centre (www.lero.ie).,,,
Murat YILMAZ,The changing role of the software engineer.,"Meade, Edward, O’Keeffe, Emma, Lyons, Niall, Lynch, Dean, Yilmaz, Murat, Güleç, Ulaş, O'Connor, Rory, Clarke, Paul","26th European and Asian Conference on Systems, Software and Services Process Improvement (EuroSPI 2019, 18-20 Sept 2019, Edinburgh, Scotland",2019,"Edward Meade, Emma O’Keeffe, Niall Lyons, Dean Lynch, Murat Yilmaz, Ulaş Güleç, Rory O'Connor, Paul Clarke","Yilmaz, Murat, ORCID: 0000-0002-2446-3224, O'Connor, Rory, ORCID: 0000-0001-9253-0313, Clarke, Paul, ORCID: 0000-0002-4487-627X","Meade, Edward, O’Keeffe, Emma, Lyons, Niall, Lynch, Dean, Güleç, Ulaş",978-3-030-28004-8,,Conference or Workshop Item (Paper),Conference,Yes,,,Software Engineer; Agile; Open Source Software; Continuous Software Engineering,Computer Science > Software engineering,DCU Faculties and Schools > Faculty of Engineering and Computing > School of Computing. Research Initiatives and Centres > Lero: The Irish Software Engineering Research Centre. ,This item is licensed under a Creative Commons Attribution-NonCommercial-Share Alike 3.0 License. View License,23882,22 Oct 2019 13:48 by  Thomas Murtagh. Last Modified 04 Feb 2020 13:22,"Walker, Alastair and O'Connor, Rory and Messnarz, Richard, (eds.)Proceedings of the 26th European and Asian Conference on Systems, Software and Services Process Improvement (EuroSPI 2019. Communications in Computer and Information Science1060.  Springer. ISBN 978-3-030-28004-8",Springer,http://dx.doi.org/10.1007/978-3-030-28005-5_53,© 2019 Springer,Science Foundation Ireland grant 13/RC/2094 to Lero - the Irish Software Research Centre (www.lero.ie).,,,
Murat YILMAZ,"An interactive 3D virtual environment to
reduce the public speaking anxiety levels
of novice software engineers.","Nazligul, Merve Denizci, Yilmaz, Murat, Güleç, Ulaş, Yılmaz, Adviye Esin, Isler, Veysi, O'Connor, Rory, Gozcu, M.A., Clarke, Paul","IET Control Theory and Applications, 13 (2). pp. 152-158",2019,"Merve Denizci Nazligul, Murat Yilmaz, Ulaş Güleç, Adviye Esin Yılmaz, Veysi Isler, Rory O'Connor, M.A. Gozcu, Paul Clarke","Yilmaz, Murat, ORCID: 0000-0002-2446-3224, O'Connor, Rory, ORCID: 0000-0001-9253-0313, Clarke, Paul, ORCID: 0000-0002-4487-627X","Nazligul, Merve Denizci, Güleç, Ulaş, Yılmaz, Adviye Esin, Isler, Veysi, Gozcu, M.A.",,1751-8644,Article (Published),,Yes,,,,Computer Science > Software engineering,UNSPECIFIED,This item is licensed under a Creative Commons Attribution-NonCommercial-Share Alike 3.0 License. View License,22589,27 Aug 2018 16:21 by  Thomas Murtagh. Last Modified 18 Dec 2019 12:16,,IET,http://doi.org/10.1049/iet-sen.2018.5140,© 2015 The Institution of Engineering and Technology,,This journal was previously known as IEE Proceedings - Control Theory and Applications 1994-2006. ISSN 1350-2379,,
Murat YILMAZ,An auction-based serious game for bug tracking.,"Üsfekes, Çağdaş, Tüzün, Eray, Yilmaz, Murat, Macit, Yagup, Clarke, Paul","IET Software, 13 (5). pp. 386-392",2019,"Çağdaş Üsfekes, Eray Tüzün, Murat Yilmaz, Yagup Macit, Paul Clarke","Tüzün, Eray, ORCID: 0000-0002-5550-7816, Yilmaz, Murat, ORCID: 0000-0002-2446-3224, Clarke, Paul, ORCID: 0000-0002-4487-627X","Üsfekes, Çağdaş, Macit, Yagup",,1751-8806,Article (Published),,Yes,,,,Computer Science > Software engineering,DCU Faculties and Schools > Faculty of Engineering and Computing > School of Computing. Research Initiatives and Centres > Lero: The Irish Software Engineering Research Centre. ,This item is licensed under a Creative Commons Attribution-NonCommercial-Share Alike 3.0 License. View License,23886,23 Oct 2019 11:23 by  Thomas Murtagh. Last Modified 19 Dec 2019 11:29,,Institution of Engineering and Technology (IET),http://dx.doi.org/10.1049/iet-sen.2018.5144,© 2019 Institution of Engineering and Technology (IET),Science Foundation Ireland grant 13/RC/2094.,,,
Murat YILMAZ,"In search of the origins and enduring impact of agile software
development.","Clarke, Paul, O'Connor, Rory, Yilmaz, Murat","2018 International Conference on Software and System Process ICSSP '18, 26-27 May 2018, Gothenburg, Sweden",2018,"Paul Clarke, Rory O'Connor, Murat Yilmaz","Clarke, Paul, ORCID: 0000-0002-4487-627X, O'Connor, Rory, ORCID: 0000-0001-9253-0313, Yilmaz, Murat, ORCID: 0000-0002-2446-3224",,978-1-4503-6459-1,,Conference or Workshop Item (Paper),Conference,Yes,,,Agile Software Development; Continuous Software Engineering,Computer Science > Software engineering,DCU Faculties and Schools > Faculty of Engineering and Computing > School of Computing. Research Initiatives and Centres > Lero: The Irish Software Engineering Research Centre. ,This item is licensed under a Creative Commons Attribution-NonCommercial-Share Alike 3.0 License. View License,22588,27 Aug 2018 15:43 by  Thomas Murtagh. Last Modified 23 Oct 2019 12:30,Proceedings of the 2018 International Conference on Software and System Process..  ACM. ISBN 978-1-4503-6459-1,ACM,https://doi.org/10.1049/iet-sen.2018.5140,© 2018 Association for Computing Machinery,,This journal was previously known as IEE Proceedings - Software,,
Murat YILMAZ,An ISO/IEC 12207 perspective on software development process adaptation.,"Marks, Gerard, O'Connor, Rory, Yilmaz, Murat, Clarke, Paul","Software Quality Professional, 20 (2). pp. 48-58",2018,"Gerard Marks, Rory O'Connor, Murat Yilmaz, Paul Clarke","O'Connor, Rory, ORCID: 0000-0001-9253-0313, Yilmaz, Murat, ORCID: 0000-0002-2446-3224, Clarke, Paul, ORCID: 0000-0002-4487-627X","Marks, Gerard",,1522-0540,Article (Published),,Yes,,,Software Development Process; Software Development Context; Agile; Lean; Process Selection,Computer Science > Software engineering,Research Initiatives and Centres > Lero: The Irish Software Engineering Research Centre. DCU Faculties and Schools > Faculty of Engineering and Computing > School of Computing. ,This item is licensed under a Creative Commons Attribution-NonCommercial-Share Alike 3.0 License. View License,22261,03 Jul 2018 13:12 by  Rory O'connor. Last Modified 01 Mar 2020 04:30,,ASQ,,© 2018 ASQ,"Science Foundation Ireland grant 13/RC/2094 to Lero, the Irish Software Engineering Research Centre (www.lero.ie) and Enterprise Ireland grant CF20133605",,,
Murat YILMAZ,Teaching ISO/IEC 12207 software lifecycle processes: a serious game approach.,"Aydan, Ufuk, Yilmaz, Murat, Clarke, Paul, O'Connor, Rory","Computer Standards & Interfaces, 54 (3). pp. 129-138",2017,"Ufuk Aydan, Murat Yilmaz, Paul Clarke, Rory O'Connor","Yilmaz, Murat, ORCID: 0000-0002-2446-3224, Clarke, Paul, ORCID: 0000-0002-4487-627X, O'Connor, Rory, ORCID: 0000-0001-9253-0313","Aydan, Ufuk",,0920-5489,Article (Published),,Yes,,,ISO/IEC 12207; Serious games; Teaching standards,Computer Science > Information technology. Computer Science > Software engineering. Engineering > Engineering education. ,Research Initiatives and Centres > Lero: The Irish Software Engineering Research Centre. DCU Faculties and Schools > Faculty of Engineering and Computing > School of Computing. ,This item is licensed under a Creative Commons Attribution-NonCommercial-Share Alike 3.0 License. View License,21796,17 May 2017 08:38 by  Rory O'connor. Last Modified 23 Oct 2019 13:02,,Elsevier,https://doi.org/10.1016/j.csi.2016.11.014,© 2017 Elsevier,,,,
Murat YILMAZ,"An industrial case study to improve the onboaring process in software management.
Yazılım Yönetiminde İşe Alıştırma Süreçlerinin İyileştirilmesi İçin Düşünülmüş Bir Endüstriyel Vaka Çalışması.","Yilmaz, Murat, Güleç, Ulaş, O'Connor, Rory, Clarke, Paul, Tüzün, Eray","11th Turkish National Software Engineering Symposium (UYMS 2017), 18-20 Oct 2017, Alanya, Turkey.",2017,"Murat Yilmaz, Ulaş Güleç, Rory O'Connor, Paul Clarke, Eray Tüzün","Yilmaz, Murat, ORCID: 0000-0002-2446-3224, Güleç, Ulaş, ORCID: 0000-0002-6084-3590, O'Connor, Rory, ORCID: 0000-0001-9253-0313, Clarke, Paul, ORCID: 0000-0002-4487-627X, Tüzün, Eray, ORCID: 0000-0002-5550-7816",,,,Conference or Workshop Item (Paper),Conference,Yes,,,Yazılım yönetimi; Sosyal etmenler; İşe alıştırma; oryantasyon.,Computer Science > Software engineering,Research Initiatives and Centres > Lero: The Irish Software Engineering Research Centre. DCU Faculties and Schools > Faculty of Engineering and Computing > School of Computing. ,This item is licensed under a Creative Commons Attribution-NonCommercial-Share Alike 3.0 License. View License,22107,06 Nov 2017 12:27 by  Rory O'connor. Last Modified 23 Oct 2019 13:07,"Turhan, Cigdem and Coskuncay, Ahmet and Yazici, Ali and Oguztuzun, Halit, (eds.)Proceedings 11th Turkish National Software Engineering Symposium (UYMS 2017)..",,http://ceur-ws.org/Vol-1980/UYMS17_paper_71.pdf,© 2017 the Authors/Owners,,Title and abstract in Turkish and English. Article in Turkish only.,,
Murat YILMAZ,A systematic investigation into the use of game elements in the context of software business landscapes: a systematic literature review.,"Olgun, Serhan, Yilmaz, Murat, Clarke, Paul, O'Connor, Rory","17th International Conference on Software Process Improvement and Capability dEtermination (SPICE 2017), 4-5 Oct 2017, Palma de Mallorca, Spain",2017,"Serhan Olgun, Murat Yilmaz, Paul Clarke, Rory O'Connor","Yilmaz, Murat, ORCID: 0000-0002-2446-3224, Clarke, Paul, ORCID: 0000-0002-4487-627X, O'Connor, Rory, ORCID: 0000-0001-9253-0313","Olgun, Serhan",978-3-319-67383-7,,Conference or Workshop Item (Paper),Conference,Yes,,,gamification; software development; game elements; systematic mapping; literature review; systematic review,Computer Science > Software engineering,Research Initiatives and Centres > Lero: The Irish Software Engineering Research Centre. DCU Faculties and Schools > Faculty of Engineering and Computing > School of Computing. ,This item is licensed under a Creative Commons Attribution-NonCommercial-Share Alike 3.0 License. View License,22026,22 Sep 2017 08:58 by  Rory O'connor. Last Modified 23 Oct 2019 12:59,Software Process Improvement and Capability Determination. Communications in Computer and Information Science (CCIS)770.  Springer. ISBN 978-3-319-67383-7,Springer,https://doi.org/10.1007/978-3-319-67383-7_28,© 2017 Springer. The original publication is available at www.springerlink.com,,,,
Murat YILMAZ,Examining reward mechanisms for effective usage of application lifecycle management tools.,"Usfekes, Cagdas, Yilmaz, Murat, Tüzün, Eray, Clarke, Paul, O'Connor, Rory","24th European Conference on Systems, Software and Services Process Improvement (EuroSPI 2017), 6-8 Sept 2017, Ostrava, Czech Republic",2017,"Cagdas Usfekes, Murat Yilmaz, Eray Tüzün, Paul Clarke, Rory O'Connor","Yilmaz, Murat, ORCID: 0000-0002-2446-3224, Clarke, Paul, ORCID: 0000-0002-4487-627X, O'Connor, Rory, ORCID: 0000-0001-9253-0313","Usfekes, Cagdas, Tüzün, Eray",978-3-319-64218-5,,Conference or Workshop Item (Paper),Conference,Yes,,,,Computer Science > Software engineering,Research Initiatives and Centres > Lero: The Irish Software Engineering Research Centre. DCU Faculties and Schools > Faculty of Engineering and Computing > School of Computing. ,This item is licensed under a Creative Commons Attribution-NonCommercial-Share Alike 3.0 License. View License,22023,21 Sep 2017 15:40 by  Rory O'connor. Last Modified 23 Oct 2019 12:58,"Systems, Software and Services Process Improvement. Communications in Computer and Information Science (CCIS)748.  Springer. ISBN 978-3-319-64218-5",Springer,https://doi.org/10.1007/978-3-319-64218-5_21,© 2017 Springer. The original publication is available at www.springerlink.com,Science Foundation Ireland grant 13/RC/2094.,,,
Murat YILMAZ,Exploring software process variation arising from differences in situational context.,"Clarke, Paul, O'Connor, Rory, Solan, David, Elger, Peter, Yilmaz, Murat, Ennis, Adam, Gerrity, Mark, McGrath, Sean, Treanor, Ryan","24th European Conference on Systems, Software and Services Process Improvement (EuroSPI 2017), 6-8 Sept 2017, Ostrava, Czech Republic",2017,"Paul Clarke, Rory O'Connor, David Solan, Peter Elger, Murat Yilmaz, Adam Ennis, Mark Gerrity, Sean McGrath, Ryan Treanor","Clarke, Paul, ORCID: 0000-0002-4487-627X, O'Connor, Rory, ORCID: 0000-0001-9253-0313, Yilmaz, Murat, ORCID: 0000-0002-2446-3224","Solan, David, Elger, Peter, Ennis, Adam, Gerrity, Mark, McGrath, Sean, Treanor, Ryan",978-3-319-64218-5,,Conference or Workshop Item (Paper),Conference,Yes,,,agile; SAFe; Situational context; software development process,Computer Science > Software engineering,Research Initiatives and Centres > Lero: The Irish Software Engineering Research Centre. DCU Faculties and Schools > Faculty of Engineering and Computing > School of Computing. ,This item is licensed under a Creative Commons Attribution-NonCommercial-Share Alike 3.0 License. View License,22019,21 Sep 2017 11:27 by  Rory O'connor. Last Modified 23 Oct 2019 12:58,"Systems, Software and Services Process Improvement. Communications in Computer and Information Science CCIS748.  Springer. ISBN 978-3-319-64218-5",Springer,https://doi.org/10.1007/978-3-319-64218-5_3,© 2017 Springer. The original publication is available at www.springerlink.com,Science Foundation Ireland grant 13/RC/2094,,,
Murat YILMAZ,Overcoming public speaking anxiety of software engineers using virtual reality exposure therapy.,"Nazligul, Merve Denizci, Yilmaz, Murat, Güleç, Ulaş, Ali Gozcu, Mert, O'Connor, Rory, Clarke, Paul","24th European Conference on Systems, Software and Services Process Improvement (EuroSPI 2017), 6-8 Sept 2017, Ostrava, Czech Republic",2017,"Merve Denizci Nazligul, Murat Yilmaz, Ulaş Güleç, Mert Ali Gozcu, Rory O'Connor, Paul Clarke","Yilmaz, Murat, ORCID: 0000-0002-2446-3224, Güleç, Ulaş, ORCID: 0000-0002-6084-3590, O'Connor, Rory, ORCID: 0000-0001-9253-0313, Clarke, Paul, ORCID: 0000-0002-4487-627X","Nazligul, Merve Denizci, Ali Gozcu, Mert",978-3-319-64218-5,,Conference or Workshop Item (Paper),Conference,Yes,,,Virtual reality; Public speaking anxiety; Personal process improvement,Computer Science > Software engineering,Research Initiatives and Centres > Lero: The Irish Software Engineering Research Centre. DCU Faculties and Schools > Faculty of Engineering and Computing > School of Computing. ,This item is licensed under a Creative Commons Attribution-NonCommercial-Share Alike 3.0 License. View License,22020,21 Sep 2017 12:20 by  Rory O'connor. Last Modified 23 Oct 2019 13:07,"Systems, Software and Services Process Improvement. Communications in Computer and Information Science (CCIS)748.  Springer. ISBN 978-3-319-64218-5",Springer,https://doi.org/10.1007/978-3-319-64218-5_15,© 2017 Springer. The original publication is available at www.springerlink.com,,,,
Murat YILMAZ,An examination of personality traits and how they impact on software development teams.,"Yilmaz, Murat, O'Connor, Rory, Colomo-Palacios, Ricardo, Clarke, Paul","Information and Software Technology, 86 . pp. 101-122",2017,"Murat Yilmaz, Rory O'Connor, Ricardo Colomo-Palacios, Paul Clarke","Yilmaz, Murat, ORCID: 0000-0002-2446-3224, O'Connor, Rory, ORCID: 0000-0001-9253-0313, Colomo-Palacios, Ricardo, ORCID: 0000-0002-1555-9726, Clarke, Paul, ORCID: 0000-0002-4487-627X",,,0950-5849,Article (Published),,Yes,,,Software Team Visualization; Interactive Personality Assessment; Software Developer Personality Traits; Social Aspects of Software Development,Business > Personnel management. Computer Science > Information technology. Computer Science > Software engineering. ,Research Initiatives and Centres > Lero: The Irish Software Engineering Research Centre. DCU Faculties and Schools > Faculty of Engineering and Computing > School of Computing. ,This item is licensed under a Creative Commons Attribution-NonCommercial-Share Alike 3.0 License. View License,21801,17 May 2017 09:50 by  Rory O'connor. Last Modified 23 Oct 2019 13:05,,Elsevier,https://doi.org/10.1016/j.infsof.2017.01.005,© 2017 Elsevier,,,,
Murat YILMAZ,"Improving social aspects of the software development process: games, gamification and related approaches.","Yilmaz, Murat, O'Connor, Rory, Mora, Manuel","Journal of Universal Computer Science, 22 (12). pp. 1487-1488",2016,"Murat Yilmaz, Rory O'Connor, Manuel Mora","O'Connor, Rory, ORCID: 0000-0001-9253-0313, Mora, Manuel, ORCID: 0000-0003-1631-5931","Yilmaz, Murat",,0948-6968,Article (Published),,Yes,,,,Computer Science > Software engineering,Research Initiatives and Centres > Lero: The Irish Software Engineering Research Centre. DCU Faculties and Schools > Faculty of Engineering and Computing > School of Computing. ,This item is licensed under a Creative Commons Attribution-NonCommercial-Share Alike 3.0 License. View License,21650,20 Jan 2017 14:47 by  Rory O'connor. Last Modified 06 Jun 2019 11:16,,Technische Universitaet Graz * Institut fuer Informationssysteme und Computer Medien,,© 2016 Technische Universitaet Graz * Institut fuer Informationssysteme und Computer Medien,,,,
Murat YILMAZ,Software Engineering Education and Games: A Systematic Literature Review.,"Kosa, Mehmet, Yilmaz, Murat, O'Connor, Rory, Clarke, Paul","Journal of Universal Computer Science, 22 (12). pp. 1558-1574",2016,"Mehmet Kosa, Murat Yilmaz, Rory O'Connor, Paul Clarke","O'Connor, Rory, ORCID: 0000-0001-9253-0313, Clarke, Paul, ORCID: 0000-0002-4487-627X","Kosa, Mehmet, Yilmaz, Murat",,0948-6968,Article (Published),,Yes,,,Systematic Review; Games; Software Engineering,Computer Science > Information technology. Computer Science > Software engineering. ,Research Initiatives and Centres > Lero: The Irish Software Engineering Research Centre. DCU Faculties and Schools > Faculty of Engineering and Computing > School of Computing. ,This item is licensed under a Creative Commons Attribution-NonCommercial-Share Alike 3.0 License. View License,21648,19 Jan 2017 16:45 by  Prof. Rory O'Connor. Last Modified 18 Oct 2018 10:03,,Technische Universitaet Graz * Institut fuer Informationssysteme und Computer Medien,http://www.jucs.org/jucs_22_12/software_engineering_education_and/jucs_22_12_1558_1574_kosa.pdf,© 2016 	Technische Universitaet Graz * Institut fuer Informationssysteme und Computer Medien,,,,
