Murat YILMAZ,Refactoring software development process terminology through the use of ontology.,"Clarke, Paul, Mesquida, Antoni Lluís, Ekert, Damjan, Ekstrom, J.J., Gornostaja, Tatjana, Johansen, Jorn, Mas, Antonia, Messnarz, Richard, Najera Villar, Blanca, O'Connor, Alexander, O'Connor, Rory, Reiner, Michael, Sauberer, Gabriele, Schmitz, Klaus-Dirk, Yilmaz, Murat","23nd European Conference on Systems, Software and Services Process Improvement (EuroSPI 2016), 14-16 Sept 2016, Graz, Austria",2016,"Paul Clarke, Antoni Lluís Mesquida, Damjan Ekert, J.J. Ekstrom, Tatjana Gornostaja, Jorn Johansen, Antonia Mas, Richard Messnarz, Blanca Najera Villar, Alexander O'Connor, Rory O'Connor, Michael Reiner, Gabriele Sauberer, Klaus-Dirk Schmitz, Murat Yilmaz","Clarke, Paul, ORCID: 0000-0002-4487-627X, O'Connor, Rory, ORCID: 0000-0001-9253-0313, Yilmaz, Murat, ORCID: 0000-0002-2446-3224","Mesquida, Antoni Lluís, Ekert, Damjan, Ekstrom, J.J., Gornostaja, Tatjana, Johansen, Jorn, Mas, Antonia, Messnarz, Richard, Najera Villar, Blanca, O'Connor, Alexander, Reiner, Michael, Sauberer, Gabriele, Schmitz, Klaus-Dirk",978-3-319-44817-6,,Conference or Workshop Item (Paper),Conference,Yes,,,"Software Development Process; Software
Development Roles; Specialised Communication; Terminology; Ontology",Computer Science > Software engineering,Research Initiatives and Centres > Lero: The Irish Software Engineering Research Centre. DCU Faculties and Schools > Faculty of Engineering and Computing > School of Computing. ,,21404,06 Oct 2016 10:16 by  Rory O'connor. Last Modified 03 Nov 2021 17:36,"23rd European Conference, EuroSPI 2016, Graz, Austria, September 14-16, 2016, Proceedings. Communications in Computer and Information Science633.  Springer International Publishing. ISBN 978-3-319-44817-6",Springer International Publishing,http://dx.doi.org/10.1007/978-3-319-44817-6_4,©2016. The original publication is available at www.springerlink.com,,,,
Murat YILMAZ,Software developer's journey: a story-driven approach to support software practitioners.,"Yilmaz, Murat, Atasoy, Berke, O'Connor, Rory, Martens, Jean-Bernard, Clarke, Paul","23nd European Conference on Systems, Software and Services Process Improvement (EuroSPI 2016), 14-16 Sept 2016, Graz, Austria",2016,"Murat Yilmaz, Berke Atasoy, Rory O'Connor, Jean-Bernard Martens, Paul Clarke","O'Connor, Rory, ORCID: 0000-0001-9253-0313, Clarke, Paul, ORCID: 0000-0002-4487-627X","Yilmaz, Murat, Atasoy, Berke, Martens, Jean-Bernard",978-3-319-44817-6,,Conference or Workshop Item (Paper),Conference,Yes,,,Agile software development; Story-driven software development; Storycrafting; Software development process,Computer Science > Software engineering,DCU Faculties and Schools > Faculty of Engineering and Computing > School of Computing,,21403,05 Oct 2016 14:58 by  Prof. Rory O'Connor. Last Modified 18 Oct 2018 10:05,"23rd European Conference, EuroSPI 2016, Graz, Austria, September 14-16, 2016, Proceedings. Communications in Computer and Information Science633.  Springer International Publishing. ISBN 978-3-319-44817-6",Springer International Publishing,http://dx.doi.org/10.1007/978-3-319-44817-6_16,©2016. The original publication is available at www.springerlink.com,,,,
Murat YILMAZ,A gamification approach to improve the software development process by exploring the personality of software practitioners.,"Yilmaz, Mert, Yilmaz, Murat, O'Connor, Rory, Clarke, Paul","Clarke, Paul O'Connor, Rory Rout, Terry and Dorling, Alec, (eds.) Software Process Improvement and Capability Determination. Communications in Computer and Information Science, 609 . Springer, pp. 71-83",2016,"Mert Yilmaz, Murat Yilmaz, Rory O'Connor, Paul Clarke","O'Connor, Rory, ORCID: 0000-0001-9253-0313, Clarke, Paul, ORCID: 0000-0002-4487-627X","Yilmaz, Mert, Yilmaz, Murat",978-3-319-38980-6,,Book Section,,Yes,,,Software process improvement; Team process; Gamification; Interactive assessment; Personality,Computer Science > Computer software. Computer Science > Software engineering. ,DCU Faculties and Schools > Faculty of Engineering and Computing > School of Computing,This item is licensed under a Creative Commons Attribution-NonCommercial-Share Alike 3.0 License. View License,21316,03 Aug 2016 10:14 by  Fran Callaghan. Last Modified 18 Oct 2018 10:16,,Springer,http://link.springer.com/chapter/10.1007%2F978-3-319-38980-6_6,"© 2016 Springer.
The original publication is available at www.springerlink.com",,,,
Murat YILMAZ,A Scrumban integrated gamification approach to guide software process improvement: a Turkish case study.,"Yilmaz, Murat, O'Connor, Rory","Tehnicki Vjesnik (Technical Gazette), 23 (1). pp. 237-245",2016,"Murat Yilmaz, Rory O'Connor","O'Connor, Rory, ORCID: 0000-0001-9253-0313","Yilmaz, Murat",,1330-3651,Article (Published),,Yes,,,Game-based agile software development; Gamification; Scrumban; Software process improvement,Computer Science > Software engineering,Research Initiatives and Centres > Lero: The Irish Software Engineering Research Centre. DCU Faculties and Schools > Faculty of Engineering and Computing > School of Computing. ,This item is licensed under a Creative Commons Attribution-NonCommercial-Share Alike 3.0 License. View License,21097,25 Feb 2016 14:01 by  Prof. Rory O'Connor. Last Modified 18 Oct 2018 10:13,,,http://hrcak.srce.hr/index.php?show=clanak&id_clanak_jezik=225597,© 2016 TV-TG,,,,
Murat YILMAZ,Understanding personality differences in software organizations using Keirsey Temperament Sorter.,"Yilmaz, Murat, O'Connor, Rory","IET Software, 9 (5). pp. 129-134",2015,"Murat Yilmaz, Rory O'Connor","Yilmaz, Murat, ORCID: 0000-0002-2446-3224, O'Connor, Rory, ORCID: 0000-0001-9253-0313",,,1751-8806,Article (Published),,Yes,,,Human factors; Software development management; Software houses; Keirsey Temperament Sorter II; Organisation personality profile; Periodic table-like structure; Personality assessment process; Personality differences; Personality temperaments; Software development organisations; Visualisation approach,Computer Science > Software engineering,Research Initiatives and Centres > Lero: The Irish Software Engineering Research Centre. DCU Faculties and Schools > Faculty of Engineering and Computing > School of Computing. ,This item is licensed under a Creative Commons Attribution-NonCommercial-Share Alike 3.0 License. View License,20993,26 Jan 2016 14:28 by  Rory O'connor. Last Modified 23 Oct 2019 13:15,,IEEE,http://dx.doi.org/10.1049/iet-sen.2014.0071,"© 2015 IEEE. Personal use of this material is permitted. Permission from IEEE must be obtained for all other users, including reprinting/ republishing this material for advertising or promotional purposes, creating new collective works for resale or redistribution to servers or lists, or reuse of any copyrighted components of this work in other works.",,,,
Murat YILMAZ,A machine-based personality oriented team recommender for software development organizations.,"Yilmaz, Murat, Al-Taei, Ali, O'Connor, Rory","22nd European Conference on Systems, Software and Services Process Improvement (EuroSPI 2015), 30 Sept - 2 Oct 2015, Ankara, Turkey",2015,"Murat Yilmaz, Ali Al-Taei, Rory O'Connor","Yilmaz, Murat, ORCID: 0000-0002-2446-3224, O'Connor, Rory, ORCID: 0000-0001-9253-0313","Al-Taei, Ali",978-3-319-24647-5,,Conference or Workshop Item (Paper),Conference,Yes,,,,Computer Science > Software engineering,Research Initiatives and Centres > Lero: The Irish Software Engineering Research Centre. DCU Faculties and Schools > Faculty of Engineering and Computing > School of Computing. ,This item is licensed under a Creative Commons Attribution-NonCommercial-Share Alike 3.0 License. View License,20990,26 Jan 2016 14:04 by  Rory O'connor. Last Modified 23 Oct 2019 13:15,"Systems, Software and Services Process Improvement. Communications in Computer and Information Science543.  Springer Verlag. ISBN 978-3-319-24647-5",Springer Verlag,http://dx.doi.org/10.1007/978-3-319-24647-5_7,,,,,
Murat YILMAZ,"Kitlesel Açık Çevrimiçi Kurslardaki Katılımcı
Profillerinin Yapay Sinir Agı Kullanılarak
Sınıflandırılması (Classification of Participants Profiles in MOOCs Using Neural Networks [in Turkish]).","Al-Taei, Ali, Yilmaz, Murat, O'Connor, Rory, Halici, Ugur","9th Turkish National Software Engineering Symposium (UYMS 2015), 9-11 Sept 2015, Izmir, Turkey.",2015,"Ali Al-Taei, Murat Yilmaz, Rory O'Connor, Ugur Halici","Yilmaz, Murat, ORCID: 0000-0002-2446-3224, O'Connor, Rory, ORCID: 0000-0001-9253-0313","Al-Taei, Ali, Halici, Ugur",,,Conference or Workshop Item (Paper),Conference,Yes,,,,Computer Science > Software engineering,Research Initiatives and Centres > Lero: The Irish Software Engineering Research Centre. DCU Faculties and Schools > Faculty of Engineering and Computing > School of Computing. ,This item is licensed under a Creative Commons Attribution-NonCommercial-Share Alike 3.0 License. View License,20985,26 Jan 2016 11:29 by  Rory O'connor. Last Modified 23 Oct 2019 13:14,Proceedings 9th Turkish National Software Engineering Symposium (UYMS 2015)..,,,,,,,
Murat YILMAZ,"Exploring the relationship between software
process adaptive capability and organisational performance.","Clarke, Paul, O'Connor, Rory, Leavy, Brian, Yilmaz, Murat","Software Engineering, IEEE Transactions on, 41 (12). pp. 1169-1183",2015,"Paul Clarke, Rory O'Connor, Brian Leavy, Murat Yilmaz","Clarke, Paul, ORCID: 0000-0002-4487-627X, O'Connor, Rory, ORCID: 0000-0001-9253-0313, Yilmaz, Murat, ORCID: 0000-0002-2446-3224","Leavy, Brian",,0098-5589,Article (Published),,Yes,,,Software development; Software management,Computer Science > Software engineering,DCU Faculties and Schools > DCU Business School. DCU Faculties and Schools > Faculty of Engineering and Computing > School of Computing. ,This item is licensed under a Creative Commons Attribution-NonCommercial-Share Alike 3.0 License. View License,20983,22 Dec 2015 09:51 by  Fran Callaghan. Last Modified 23 Oct 2019 13:14,,IEEE,http:/dx.doi.org/10.1109/TSE.2015.2467388,"© 2015 IEEE. Personal use of this material is permitted. Permission from IEEE must be obtained for all other users, including reprinting/ republishing this material for advertising or promotional purposes, creating new collective works for resale or redistribution to servers or lists, or reuse of any copyrighted components of this work in other works.",,,,
Murat YILMAZ,Exploring the belief systems of software development professionals.,"O'Connor, Rory, Yilmaz, Murat","Cybernetics and Systems: An International Journal, 46 (6-7). pp. 528-542",2015,"Rory O'Connor, Murat Yilmaz","O'Connor, Rory, ORCID: 0000-0001-9253-0313, Yilmaz, Murat, ORCID: 0000-0002-2446-3224",,,0196-9722,Article (Published),,Yes,,,Belief systems; Grounded theory; Software development; Software process; Qualitative research,Computer Science > Software engineering,Research Initiatives and Centres > Lero: The Irish Software Engineering Research Centre. DCU Faculties and Schools > Faculty of Engineering and Computing > School of Computing. ,This item is licensed under a Creative Commons Attribution-NonCommercial-Share Alike 3.0 License. View License,20994,26 Jan 2016 14:32 by  Rory O'connor. Last Modified 23 Oct 2019 13:13,,Taylor & Francis,http://dx.doi.org/10.1080/01969722.2015.1038483,"© 2015 Taylor & Francis.
This is an electronic version of an article published in Cybernetics and Systems: An International Journal 46(6-7)",,,,
Murat YILMAZ,Towards a serious game to teach ISO/IEC 12207 software lifecycle process: an interactive learning approach.,"Aydan, Ufuk, Yilmaz, Murat, O'Connor, Rory","15th International Conference on Software Process Improvement and Capability dEtermination (SPICE 2015), 15-17 June 2015, Gothenburg, Swedan.",2015,"Ufuk Aydan, Murat Yilmaz, Rory O'Connor","Yilmaz, Murat, ORCID: 0000-0002-2446-3224, O'Connor, Rory, ORCID: 0000-0001-9253-0313","Aydan, Ufuk",,,Conference or Workshop Item (Paper),Conference,Yes,,,Process improvement; ISO/IEC 12207; ISO; Standards,Computer Science > Software engineering,Research Initiatives and Centres > Lero: The Irish Software Engineering Research Centre. DCU Faculties and Schools > Faculty of Engineering and Computing > School of Computing. ,This item is licensed under a Creative Commons Attribution-NonCommercial-Share Alike 3.0 License. View License,20668,24 Jun 2015 10:48 by  Rory O'connor. Last Modified 23 Oct 2019 13:12,Software Process Improvement and Capability Determination. Communications in Computer and Information Science526.  Springer.,Springer,http://dx.doi.org/10.1007/978-3-319-19860-6_17,"© 2015 Springer.
The original publication is available at www.springerlink.com",,,,
Murat YILMAZ,Effective social productivity measurements during software development: an empirical study.,"Yilmaz, Murat, O'Connor, Rory, Clarke, Paul","International Journal of Software Engineering and Knowledge Engineering (ijseke), 26 (3)",2015,"Murat Yilmaz, Rory O'Connor, Paul Clarke","Yilmaz, Murat, ORCID: 0000-0002-2446-3224, O'Connor, Rory, ORCID: 0000-0001-9253-0313, Clarke, Paul, ORCID: 0000-0002-4487-627X",,,0218-1940,Article (Published),,Yes,,,Structure equation modeling; Productivity factors of software development; Socio-technical aspects of software development,Computer Science > Computer software. Computer Science > Software engineering. ,DCU Faculties and Schools > Faculty of Engineering and Computing > School of Computing,This item is licensed under a Creative Commons Attribution-NonCommercial-Share Alike 3.0 License. View License,21319,03 Aug 2016 10:36 by  Fran Callaghan. Last Modified 23 Oct 2019 13:10,,World Scientific Publishing,http://dx.doi.org/10.1142/S0218194016500194,© 2016 World Scientific Publishing,,,,
Murat YILMAZ,Software development roles: a multi-project empirical investigation.,"Yilmaz, Murat, O'Connor, Rory, Clarke, Paul","ACM SIGSOFT Software Engineering Notes, 40 (1). pp. 1-5",2015,"Murat Yilmaz, Rory O'Connor, Paul Clarke","Yilmaz, Murat, ORCID: 0000-0002-2446-3224, O'Connor, Rory, ORCID: 0000-0001-9253-0313, Clarke, Paul, ORCID: 0000-0002-4487-627X",,,0163-5948,Article (Published),,Yes,,,Productivity; Software Process; Software Teams,Computer Science > Information technology. Computer Science > Software engineering. ,Research Initiatives and Centres > Lero: The Irish Software Engineering Research Centre. DCU Faculties and Schools > Faculty of Engineering and Computing > School of Computing. ,This item is licensed under a Creative Commons Attribution-NonCommercial-Share Alike 3.0 License. View License,20469,11 Feb 2015 14:12 by  Rory O'connor. Last Modified 23 Oct 2019 13:11,,Association for Computing Machinery,http://dl.acm.org/citation.cfm?id=2693239,© 2015 ACM,,,,
Murat YILMAZ,Towards a quest-based contextualization process for game-based learning.,"Yilmaz, Murat, Saran, Murat, O'Connor, Rory","8th European Conference on Games Based Learning (ECGBL 2014), 9-10 Oct 2014, Berlin, Germany.",2014,"Murat Yilmaz, Murat Saran, Rory O'Connor","Yilmaz, Murat, ORCID: 0000-0002-2446-3224, O'Connor, Rory, ORCID: 0000-0001-9253-0313","Saran, Murat",,,Conference or Workshop Item (Paper),Conference,Yes,,,game-based learning; quest creation process; contextualization; questing structure; thematic analysis; expert reviews,Social Sciences > Educational technology. Computer Science > Software engineering. ,DCU Faculties and Schools > Faculty of Engineering and Computing > School of Computing,This item is licensed under a Creative Commons Attribution-NonCommercial-Share Alike 3.0 License. View License,20337,18 Dec 2014 11:29 by  Rory O'connor. Last Modified 23 Oct 2019 13:18,Busch C (ed) 8th European Conference on Games Based Learning.2.  Academic Conferences and Publishing International.,Academic Conferences and Publishing International,,© 2014 ACPI,,,,
Murat YILMAZ,"Investigating the factors affecting software development productivity by using exploratory factor analysis [in Turkish - Yazılım Geliştirme Üretkenliğini Etkileyen
Faktörlerin Açımlayıcı Faktör Analizi Yöntemi
Kullanılarak İncelenmesi].","Yilmaz, Murat, O'Connor, Rory, Görür, Abdul Kadir","8th Turkish National Software Engineering Symposium (UYMS 2014), 8-10 Sept 2014, Güzelyurt, KKTC, Turkey.",2014,"Murat Yilmaz, Rory O'Connor, Abdul Kadir Görür","Yilmaz, Murat, ORCID: 0000-0002-2446-3224, O'Connor, Rory, ORCID: 0000-0001-9253-0313","Görür, Abdul Kadir",,,Conference or Workshop Item (Paper),Conference,Yes,,,,Computer Science > Software engineering,Research Initiatives and Centres > Lero: The Irish Software Engineering Research Centre. DCU Faculties and Schools > Faculty of Engineering and Computing > School of Computing. ,This item is licensed under a Creative Commons Attribution-NonCommercial-Share Alike 3.0 License. View License,20146,19 Sep 2014 11:06 by  Rory O'connor. Last Modified 23 Oct 2019 13:18,,,http://ceur-ws.org/Vol-1221/38_Bildiri.pdf,,,,,
Murat YILMAZ,An exploration of individual personality types in software development.,"Yilmaz, Murat, O'Connor, Rory, Clarke, Paul","21th European Conference on Systems, Software and Services Process Improvement (EuroSPI 2014), 25-27 June 2014, Luxembourg.",2014,"Murat Yilmaz, Rory O'Connor, Paul Clarke","Yilmaz, Murat, ORCID: 0000-0002-2446-3224, O'Connor, Rory, ORCID: 0000-0001-9253-0313, Clarke, Paul, ORCID: 0000-0002-4487-627X",,,,Conference or Workshop Item (Paper),Conference,Yes,,,"Software Developers Personalities; Personality Proling; Myers-
Briggs Type Indicator (MBTI); Questionnaire Validation",Computer Science > Software engineering,Research Initiatives and Centres > Lero: The Irish Software Engineering Research Centre. DCU Faculties and Schools > Faculty of Engineering and Computing > School of Computing. ,This item is licensed under a Creative Commons Attribution-NonCommercial-Share Alike 3.0 License. View License,20013,30 Jun 2014 13:31 by  Rory O'connor. Last Modified 23 Oct 2019 13:18,"Systems, Software and Services Process Improvement. Communications in Computer and Information Science425.  Springer Verlag.",Springer Verlag,,"© 2014 Springer-Verlag
The original publication is available at www.springerlink.com",,,,
Murat YILMAZ,A personality type measurement game considered for software development organizations [in Turkish].,"Yilmaz, Murat, O'Connor, Rory","7th Turkish National Software Engineering Symposium (UYMS 2013), 25-28 Sept 2013, Izmir, Turkey.",2013,"Murat Yilmaz, Rory O'Connor","Yilmaz, Murat, ORCID: 0000-0002-2446-3224, O'Connor, Rory, ORCID: 0000-0001-9253-0313",,,,Conference or Workshop Item (Paper),Conference,Yes,,,,Computer Science > Software engineering,Research Initiatives and Centres > Lero: The Irish Software Engineering Research Centre. DCU Faculties and Schools > Faculty of Engineering and Computing > School of Computing. ,This item is licensed under a Creative Commons Attribution-NonCommercial-Share Alike 3.0 License. View License,19609,23 Oct 2013 14:58 by  Rory O'connor. Last Modified 23 Oct 2019 13:18,,,,,,This paper is in Turkish,,
Murat YILMAZ,A software process engineering approach to understanding software productivity and team personality characteristics: an empirical investigation.,"Yilmaz, Murat","Master of Engineering thesis, Dublin City University.",2013,Murat Yilmaz,"Yilmaz, Murat, ORCID: 0000-0002-2446-3224",,,,Thesis (Master of Engineering),,No,March 2013,"O'Connor, Rory",,Business > Managerial economics. Computer Science > Information technology. Business > Employee motivation. Computer Science > Software engineering. Business > Management. Business > Economics. ,Research Initiatives and Centres > Lero: The Irish Software Engineering Research Centre. DCU Faculties and Schools > Faculty of Engineering and Computing > School of Computing. ,This item is licensed under a Creative Commons Attribution-NonCommercial-No Derivative Works 3.0 License. View License,17731,03 Apr 2013 12:51 by  Rory O'connor. Last Modified 23 Oct 2019 13:17,,,,,,,,
Murat YILMAZ,Towards the understanding and classification of the personality traits of software development practitioners: situational context cards approach.,"Yilmaz, Murat, O'Connor, Rory","38th Euromicro Conference on Software Engineering and Advanced Applications, 5-8 Sept 2012, Izmir, Turkey.",2012,"Murat Yilmaz, Rory O'Connor","Yilmaz, Murat, ORCID: 0000-0002-2446-3224, O'Connor, Rory, ORCID: 0000-0001-9253-0313",,,,Conference or Workshop Item (Paper),Conference,Yes,,,Software Engineers; Personality Traits; Behaviour,Computer Science > Computer software. Computer Science > Software engineering. ,Research Initiatives and Centres > Lero: The Irish Software Engineering Research Centre. DCU Faculties and Schools > Faculty of Engineering and Computing > School of Computing. ,This item is licensed under a Creative Commons Attribution-NonCommercial-Share Alike 3.0 License. View License,17610,05 Dec 2012 11:16 by  Rory O'connor. Last Modified 09 Mar 2020 12:23,,,,,,,,
Murat YILMAZ,A market based approach for resolving resource constrained task allocation problems in a software development process.,"Yilmaz, Murat, O'Connor, Rory","19th European Conference on Systems, Software and Services Process Improvement (EuroSPI 2012), 25-27 June 2012, Vienna, Austria.",2012,"Murat Yilmaz, Rory O'Connor","Yilmaz, Murat, ORCID: 0000-0002-2446-3224, O'Connor, Rory, ORCID: 0000-0001-9253-0313",,,,Conference or Workshop Item (Paper),Conference,Yes,,,"Software Process Improvement; Game Theory,Process Simulation; Mechanism Design; Auction Mechanism; Task Allocations",Computer Science > Software engineering,Research Initiatives and Centres > Lero: The Irish Software Engineering Research Centre. DCU Faculties and Schools > Faculty of Engineering and Computing > School of Computing. ,This item is licensed under a Creative Commons Attribution-NonCommercial-Share Alike 3.0 License. View License,17612,05 Dec 2012 11:24 by  Rory O'connor. Last Modified 09 Mar 2020 12:24,"Systems, Software and Services Process Improvement. Communications in Computer and Information Science 301.  Springer-Verlag.",Springer-Verlag,http://dx.doi.org/10.1007/978-3-642-31199-4_3,"© 2012 Springer-Verlag
The original publication is available at www.springerlink.com",,,,
Murat YILMAZ,A hierarchy of SPI activities for software SMEs: results from ISO/IEC 12207-based SPI assessments.,"Clarke, Paul, O'Connor, Rory, Yilmaz, Murat","12th International Conference on Software Process Improvement and Capability dEtermination,, 29-31 May 2012, Palma, Spain",2012,"Paul Clarke, Rory O'Connor, Murat Yilmaz","Clarke, Paul, ORCID: 0000-0002-4487-627X, O'Connor, Rory, ORCID: 0000-0001-9253-0313, Yilmaz, Murat, ORCID: 0000-0002-2446-3224",,978-3-642-30439-2,,Conference or Workshop Item (Paper),Conference,Yes,,,Software development process; SPI; software SMEs,Computer Science > Software engineering,Research Initiatives and Centres > Lero: The Irish Software Engineering Research Centre. DCU Faculties and Schools > Faculty of Engineering and Computing > School of Computing. ,This item is licensed under a Creative Commons Attribution-NonCommercial-Share Alike 3.0 License. View License,17073,19 Jun 2012 13:47 by  Rory O'connor. Last Modified 09 Mar 2020 12:24,Software Process Improvement and Capability Determination. Communications in Computer and Information Science290(8).  Springer. ISBN 978-3-642-30439-2,Springer,http://dx.doi.org/10.1007/978-3-642-30439-2_6,"©2012 Springer
The original publication is available at www.springerlink.com",,,,
Murat YILMAZ,A systematic approach to the comparison of roles in the software development processes.,"Yilmaz, Murat, O'Connor, Rory, Clarke, Paul","12th International Conference on Software Process Improvement and Capability dEtermination,, 29-31 May 2012, Palma, Spain",2012,"Murat Yilmaz, Rory O'Connor, Paul Clarke","Yilmaz, Murat, ORCID: 0000-0002-2446-3224, O'Connor, Rory, ORCID: 0000-0001-9253-0313, Clarke, Paul, ORCID: 0000-0002-4487-627X",,978-3-642-30439-2,,Conference or Workshop Item (Paper),Conference,Yes,,,ISO/IEC 12207; SPI; VSE,Computer Science > Software engineering,Research Initiatives and Centres > Lero: The Irish Software Engineering Research Centre. DCU Faculties and Schools > Faculty of Engineering and Computing > School of Computing. ,This item is licensed under a Creative Commons Attribution-NonCommercial-Share Alike 3.0 License. View License,17072,19 Jun 2012 13:42 by  Rory O'connor. Last Modified 09 Mar 2020 12:24,Software Process Improvement and Capability Determination. Communications in Computer and Information Science290(8).  Springer. ISBN 978-3-642-30439-2,Springer,http://dx.doi.org/10.1007/978-3-642-30439-2_18,"©2012 Springer-Verlag
The original publication is available at www.springerlink.com",,,,
Murat YILMAZ,Social capital as a determinant factor of software development productivity: An empirical study using Sstructural equation modeling.,"Yilmaz, Murat, O'Connor, Rory","International Journal of Human Capital and Information Technology Professionals, 3 (2). pp. 40-62",2012,"Murat Yilmaz, Rory O'Connor","Yilmaz, Murat, ORCID: 0000-0002-2446-3224, O'Connor, Rory, ORCID: 0000-0001-9253-0313",,,1947-3478,Article (Published),,Yes,,,Social Capital of Software Development; Software Development Productivity; Software Productivity Factors; Software Productivity Improvement; Structural Equation Modeling,Computer Science > Information technology. Computer Science > Software engineering. ,Research Initiatives and Centres > Lero: The Irish Software Engineering Research Centre. DCU Faculties and Schools > Faculty of Engineering and Computing > School of Computing. ,This item is licensed under a Creative Commons Attribution-NonCommercial-Share Alike 3.0 License. View License,17545,11 Oct 2012 13:11 by  Rory O'connor. Last Modified 09 Mar 2020 12:23,,IGI Global,"http://dx,doi.org/10.4018/jhcitp.2012040104",© 2012 IGI Global,,,,
