Murat YILMAZ,A software process engineering approach to improving software team productivity using socioeconomic mechanism design.,"Yilmaz, Murat, O'Connor, Rory","Software Engineering Notes, 36 (4). pp. 1-5",2011,"Murat Yilmaz, Rory O'Connor","Yilmaz, Murat, ORCID: 0000-0002-2446-3224, O'Connor, Rory, ORCID: 0000-0002-2446-3224",,,0163-5948,Article (Published),,Yes,,,Software process; team,Computer Science > Software engineering,Research Initiatives and Centres > Lero: The Irish Software Engineering Research Centre. DCU Faculties and Schools > Faculty of Engineering and Computing > School of Computing. ,This item is licensed under a Creative Commons Attribution-NonCommercial-Share Alike 3.0 License. View License,16731,11 Jan 2012 11:50 by  Rory O'connor. Last Modified 23 Oct 2019 13:19,,ACM,http://doi.acm.org/10.1145/2020976.2020998,"© ACM, 2010. This is the author's version of the work. It is posted here by permission of ACM for your personal use. Not for redistribution. The definitive version was published in Software Engineering Notes, {VOL36, ISS4, (2010)} http://doi.acm.org/10.1145/2020976.2020998",,,,
Murat YILMAZ,Oyun Kuramı Kullanarak Yazılım Takımlarının Üretkenliğini Artırmak İçin Geliştirilen Bir Yazılım Süreç Mühendisliği Yaklaşımı.,"Yilmaz, Murat, O'Connor, Rory",Turkish National Software Engineering Symposium.,2011,"Murat Yilmaz, Rory O'Connor","Yilmaz, Murat, ORCID: 0000-0002-2446-3224, O'Connor, Rory, ORCID: 0000-0002-2446-3224",,,,Conference or Workshop Item (Paper),Conference,Yes,,,,Computer Science > Software engineering,DCU Faculties and Schools > Faculty of Engineering and Computing > School of Computing,This item is licensed under a Creative Commons Attribution-NonCommercial-Share Alike 3.0 License. View License,18652,15 Jul 2013 10:43 by  Rory O'connor. Last Modified 23 Oct 2019 13:19,,,,,,,,
Murat YILMAZ,An approach for improving the social aspects of the software development process by using a game theoretic perspective: towards a theory of social productivity of software development teams.,"Yilmaz, Murat, O'Connor, Rory","6th International Conference on Software and Data Technologies, 18-21 Jul 2011, Seville, Spain",2011,"Murat Yilmaz, Rory O'Connor","Yilmaz, Murat, ORCID: 0000-0002-2446-3224, O'Connor, Rory, ORCID: 0000-0002-2446-3224",,978-989-8425-76-8,,Conference or Workshop Item (Paper),Conference,Yes,,,"Software Process Improvement; Team Dynamics; Game Theory; Mechanism Design; Research Framework; Software Engineering Economics, Productivity, Social Aspects of Development",Computer Science > Software engineering,Research Initiatives and Centres > Lero: The Irish Software Engineering Research Centre. DCU Faculties and Schools > Faculty of Engineering and Computing > School of Computing. ,This item is licensed under a Creative Commons Attribution-NonCommercial-Share Alike 3.0 License. View License,16732,11 Jan 2012 11:27 by  Rory O'connor. Last Modified 23 Oct 2019 13:20,,SciTePress,,,,,,
Murat YILMAZ,An empirical investigation into social productivity of a software process: An approach by using the structural equation modeling.,"Yilmaz, Murat, O'Connor, Rory","18th European Software Process Improvement Conference, 27-29 June 2011, Roskilde, Denmark",2011,"Murat Yilmaz, Rory O'Connor","Yilmaz, Murat, ORCID: 0000-0002-2446-3224, O'Connor, Rory, ORCID: 0000-0002-2446-3224",,978-3-642-22206-1,,Conference or Workshop Item (Paper),Conference,Yes,,,software development; structured equation modelling; SEM,Computer Science > Software engineering,Research Initiatives and Centres > Lero: The Irish Software Engineering Research Centre. DCU Faculties and Schools > Faculty of Engineering and Computing > School of Computing. ,This item is licensed under a Creative Commons Attribution-NonCommercial-Share Alike 3.0 License. View License,16726,10 Jan 2012 14:14 by  Rory O'connor. Last Modified 23 Oct 2019 13:21,"Systems, Software and Service Process Improvement. Communications in Computer and Information Science172.  Springer Verlag. ISBN 978-3-642-22206-1",Springer Verlag,http://dx.doi.org/10.1007/978-3-642-22206-1_14,"© 2011 Springer-Verlag.
The original publication is available at www.springerlink.com",,,,
Murat YILMAZ,Improving software development process through economic mechanism design.,"Yilmaz, Murat, O'Connor, Rory, Collins, John","17th European Software Process Improvement Conference, 1-3 Sept 2010, Grenoble, France",2010,"Murat Yilmaz, Rory O'Connor, John Collins","Yilmaz, Murat, ORCID: 0000-0002-2446-3224, O'Connor, Rory, ORCID: 0000-0002-2446-3224","Collins, John",978-3-642-15666-3,,Conference or Workshop Item (Paper),Conference,Yes,,,Software process; SPI,Computer Science > Software engineering,Research Initiatives and Centres > Lero: The Irish Software Engineering Research Centre. DCU Faculties and Schools > Faculty of Engineering and Computing > School of Computing. ,This item is licensed under a Creative Commons Attribution-NonCommercial-Share Alike 3.0 License. View License,16730,11 Jan 2012 11:58 by  Rory O'connor. Last Modified 23 Oct 2019 11:39,"Systems, Software and Service Process Improvement. Communications in Computer and Information Science99.  Springer Verlag. ISBN 978-3-642-15666-3",Springer Verlag,http://dx.doi.org/10.1007/978-3-642-15666-3_16,"© 2010 Springer-Verlag.
The original publication is available at www.springerlink.com",,,,
Murat YILMAZ,Maximizing the value of the software development process by game theoretic analysis.,"Yilmaz, Murat, O'Connor, Rory","11th International Conference on Product Focused Software, 21-23 Jun 2010, Limerick, Ireland",2010,"Murat Yilmaz, Rory O'Connor","Yilmaz, Murat, ORCID: 0000-0002-2446-3224, O'Connor, Rory, ORCID: 0000-0002-2446-3224",,978-1-4503-0281-4,,Conference or Workshop Item (Paper),Conference,Yes,,,software development process; software engineering economics; economic mechanism design; game theory,Computer Science > Software engineering,Research Initiatives and Centres > Lero: The Irish Software Engineering Research Centre. DCU Faculties and Schools > Faculty of Engineering and Computing > School of Computing. ,This item is licensed under a Creative Commons Attribution-NonCommercial-Share Alike 3.0 License. View License,16734,11 Jan 2012 11:21 by  Rory O'connor. Last Modified 23 Oct 2019 13:21,Proceedings of the 11th International Conference on Product Focused Software..  ACM. ISBN 978-1-4503-0281-4,ACM,http://doi.acm.org/10.1145/1961258.1961279,"© ACM, 2010. This is the author's version of the work. It is posted here by permission of ACM for your personal use. Not for redistribution. The definitive version was published in 'Proceedings of the 11th International Conference on Product Focused Software' http://doi.acm.org/10.1145/1961258.1961279",,,,
